{
    "provider": "azure",
    "region": "Sweden Central",
    "version": "v1.0.0",
    "services": [
        {
            "type": "compute.instance",
            "instance_id": "sky-azure-vm-01",
            "size": "small",
            "os": "debian",
            "subscription_id": "afdba574-1b59-4204-a199-eb4386ce7e9e"
        },
        {
            "type": "storage.object",
            "bucket_id": "skycontroldemostor",
            "storage_tier": "standard",
            "versioning": true,
            "subscription_id": "afdba574-1b59-4204-a199-eb4386ce7e9e"
        }
    ]
}
