{
  "provider": "gcp",
  "region": "europe-west3",
  "version": "v1.0.0",
  "services": [
    {
      "type": "compute.instance",
      "instance_id": "simple-vm-01",
      "size": "small",
      "os": "ubuntu",
      "project_id": "project-9d21db3e-1ebb-4126-a89"
    },
    {
        "type": "storage.object",
        "bucket_id": "sky-control-demo-bucket-12345",
        "storage_tier": "standard",
        "versioning": true
    }
  ]
}
